{
  "$schema": "../../docs/gadget.schema.json",
  "id": "photo-stitch",
  "name": "Photo Stitch",
  "kind": "gadget",
  "host": "pc",
  "desc": "Join photos vertically, side by side or in a grid.",
  "about": "Put several photos into one image: stacked, side by side or in a grid, with borders, gaps and an exact output size. Everything happens in your browser.",
  "icon": "icon.svg",
  "proxy": {
    "port": 8101,
    "upstream": "http://photo-stitch:80"
  },
  "intents": [
    {
      "phrase": "…put several photos together into one picture",
      "group": "photos",
      "desc": "Stacked, side by side or in a grid, with gaps, borders and an exact size. Nothing leaves your phone."
    }
  ],
  "deploy": {
    "stacks": [
      {
        "name": "photo-stitch",
        "host": "pc",
        "compose": "docker-compose.yml",
        "build": {
          "image": "photo-stitch:latest",
          "context": "."
        }
      }
    ]
  }
}
